,Crystal System,symmetry ops,ShannonForce,meanbv,stdbv,meanValenceOcc
"mp-300771444, LiMnAsCO7, Li2MnAsCO7, mp-770905, mp-771488",1.0,2.0,-2.5267730980727006,-0.031765542355891456,0.5615363696922894,28796.090909090908
"mp-300771444, Li2MnAsCO7, Li3MnAsCO7, mp-771488, mp-771444",1.0,4.0,-2.083725001110244,-0.029044635667816527,0.5457990486312939,26554.916666666668
"mp-300771450, Li4Ni3(SnO5)2, Li5Ni3(SnO5)2, mp-762617, mp-771450",2.0,2.0,-0.9270500252083682,-0.16579113843165114,0.47391378182648214,24011.947368421053
"mp-300771451, Li4Mn2Cu3O10, Li5Mn2Cu3O10, mp-849495, mp-771451",2.0,2.0,-0.3341714551193469,-0.3227402610342461,0.47591246960252603,19385.105263157893
"mp-300771459, Li3CrNi3O8, Li4CrNi3O8, mp-851026, mp-771459",2.0,1.0,-0.8840121948534897,-0.2876360891658226,0.4644253695743348,24269.6
"mp-300771467, Na3Mn2P2(CO7)2, Na3Li3Mn2P2(CO7)2, mp-775625, mp-771467",2.0,1.0,-2.3166906901470985,-0.009317120440958936,0.5325584042127921,28010.478260869564
"mp-300771489, LiNiCSO7, Li2NiCSO7, mp-770369, mp-771489",1.0,2.0,-2.53982224106527,-0.11285224960455344,0.5434305742517949,28784.81818181818
"mp-300771505, CrCo5O12, Li4CrCo5O12, mp-773306, mp-771505",1.0,4.0,-0.8755161499375893,-0.37571507920095537,0.5163528047037498,29862.38888888889
"mp-300771509, Mn5Cr2O12, Li3Mn5Cr2O12, mp-771632, mp-850947",1.0,2.0,-1.2982229196087376,-0.1851682303559505,0.4998204937972604,28356.736842105263
"mp-300771509, Li3Mn5Cr2O12, Li4Mn5Cr2O12, mp-850947, mp-850972",1.0,2.0,-0.6702507994607504,-0.14163940700161887,0.4765031723579853,24756.409090909092
"mp-300771509, Li4Mn5Cr2O12, Li5Mn5Cr2O12, mp-850972, mp-771509",1.0,2.0,-0.6211091212304405,-0.16700387210122133,0.4667272476826803,23772.608695652172
"mp-300771514, TiCo5O12, Li4TiCo5O12, mp-771460, mp-771514",1.0,4.0,-0.9769320047067019,-0.3507935559124406,0.5182136481798453,29897.277777777777
"mp-300771521, La6Mn3O14, LiLa6Mn3O14, mp-773521, mp-771521",1.0,2.0,-0.7600673428238026,-0.160027530409236,0.49119778376100615,27505.608695652172
"mp-300771522, Li4Fe2Cu3O10, Li5Fe2Cu3O10, mp-849416, mp-771522",2.0,2.0,-0.39923371925112355,-0.3750065181333884,0.4541062002583602,19373.21052631579
"mp-300771529, MnV3O8, Li4MnV3O8, mp-776985, mp-771529",2.0,1.0,-3.1644666378397197,-0.14310593622099785,0.4546154005914187,30010.0
"mp-300771531, Li3Fe7O12, Li4Fe7O12, mp-762465, mp-763675",1.0,2.0,-0.6753750354881957,-0.13680798543236783,0.5225808904216994,24843.545454545456
"mp-300771531, Li4Fe7O12, Li5Fe7O12, mp-763675, mp-771531",1.0,2.0,-0.5494832825467816,-0.10761816337808301,0.5349607332260156,23831.391304347828
"mp-300771542, LiFeAsCO7, Li2FeAsCO7, mp-770902, mp-771469",1.0,2.0,-2.405008683705409,-0.07690458257787798,0.5427036825314189,28785.81818181818
"mp-300771542, Li2FeAsCO7, Li3FeAsCO7, mp-771469, mp-771542",1.0,4.0,-1.9014419764250345,-0.025262265831772195,0.5546789322040903,26579.333333333332
"mp-300771545, Mn5CoO12, Li4Mn5CoO12, mp-771458, mp-771545",1.0,4.0,-1.0748656001394759,-0.22188425279399024,0.5051889471188182,29891.61111111111
"mp-300771548, Li3Mn2Ni5O12, Li5Mn2Ni5O12, mp-762611, mp-771548",2.0,1.0,-0.3933263260689505,-0.23313408222098053,0.477641191645408,24725.863636363636
"mp-300771549, Ti3VO8, Li2Ti3VO8, mp-771867, mp-771549",1.0,2.0,-1.3583457120382367,-0.13681946275802206,0.5019462342851307,30040.333333333332
"mp-300771552, Li2Ti2Mn5O12, Li3Ti2Mn5O12, mp-762569, mp-763830",1.0,2.0,-0.8178448619287854,-0.15152101372302212,0.4911539783675017,25898.714285714286
"mp-300771552, Li3Ti2Mn5O12, Li4Ti2Mn5O12, mp-763830, mp-762814",2.0,1.0,-0.33603136212473317,-0.15201240758486298,0.48002789481972935,24816.68181818182
"mp-300771552, Li4Ti2Mn5O12, Li5Ti2Mn5O12, mp-762814, mp-771552",1.0,2.0,-0.6741886240371702,-0.1524610715456744,0.46986929679784994,23828.739130434784
"mp-300771555, Li3Fe5(NiO6)2, Li5Fe5(NiO6)2, mp-762771, mp-771555",1.0,2.0,-0.70808499736334,-0.19270487471465206,0.5036420140024211,24799.272727272728
"mp-300771573, V2Sn(PO4)3, Li2V2Sn(PO4)3, mp-853198, mp-771573",5.0,12.0,-1.3367702646721553,0.1423703622933067,0.5051255463405252,30373.166666666668
"mp-300771580, Li3Fe3TeO8, Li4Fe3TeO8, mp-772334, mp-771580",2.0,1.0,-0.18848079089318576,-0.07217602502767813,0.4901195767746011,24387.466666666667
"mp-300771593, Li4Fe2Ni5O12, Li5Fe2Ni5O12, mp-762761, mp-771593",2.0,1.0,-0.5596730113310924,-0.24175014884852639,0.47655960526269264,23749.608695652172
"mp-300771605, Li4Cr3(FeO4)3, Li2CrFeO4, mp-850905, mp-771605",2.0,1.0,-0.7125125723900139,-0.16896437157020278,0.4870220827260183,24842.363636363636
"mp-300771607, Li5Cr5O12, Li6Cr5O12, mp-762528, mp-781691",2.0,1.0,-0.3962921095465199,-0.20386282397256375,0.4623932019174722,24851.454545454544
"mp-300771607, Li6Cr5O12, Li7Cr5O12, mp-781691, mp-771607",2.0,1.0,-0.6594761202136503,-0.1775923208900424,0.45277190513006227,23860.478260869564
"mp-300771611, VO2, LiV2O4, mp-634430, mp-19394",2.0,1.0,-1.0316246569277179,-0.13958613876077633,0.46950689753858255,29930.333333333332
"mp-300771611, LiV2O4, Li11V16O32, mp-19394, mp-762453",7.0,48.0,0.0,-0.15670048616498863,0.6944361608239026,285.14285714285717
"mp-300771611, Li11V16O32, Li17V16O32, mp-762453, mp-761629",2.0,1.0,0.0,-0.12063777177621753,0.6831840108506025,278.3728813559322
"mp-300771611, Li17V16O32, Li5V4O8, mp-761629, mp-771611",2.0,1.0,-0.3478820010705766,-0.05968727283134998,0.4268027743807707,22546.092307692306
"mp-300771615, LiTiVO4, Li2TiVO4, mp-772392, mp-771615",3.0,8.0,-0.6751576932393768,-0.09377435271958677,0.46137730941407645,25960.14285714286
"mp-300771616, Li5Mn5O12, Li6Mn5O12, mp-762417, mp-764759",2.0,1.0,-0.5374051113250754,-0.15525718047996506,0.4689004009449207,24864.772727272728
"mp-300771616, Li6Mn5O12, Li7Mn5O12, mp-764759, mp-771616",1.0,2.0,-0.6445396960919553,-0.14846837533296617,0.46471727555428666,23866.391304347828
"mp-300771617, Li3Fe5O12, Li5Fe5O12, mp-763871, mp-762423",2.0,1.0,0.0,-0.6264798350885414,0.7914786318959997,377.65
"mp-300771617, Li5Fe5O12, Li6Fe5O12, mp-762423, mp-780188",2.0,1.0,0.0,-0.5192968594610211,0.7625391088159698,357.1363636363636
"mp-300771617, Li6Fe5O12, Li7Fe5O12, mp-780188, mp-771617",2.0,1.0,0.0,-0.47269556570992544,0.7499567074768261,348.2173913043478
"mp-300771618, Li3V3Cr2O10, Li5V3Cr2O10, mp-850150, mp-771618",2.0,2.0,-0.3892800246727896,-0.11100479768937525,0.4444542765114792,25244.222222222223
"mp-300771623, LiMn3(PO4)4, Li2Mn3(PO4)4, mp-762567, mp-762618",1.0,2.0,-2.1490710831495963,0.11427137822278122,0.5038025306854298,30450.458333333332
"mp-300771623, Li2Mn3(PO4)4, Li3Mn3(PO4)4, mp-762618, mp-762574",2.0,1.0,-1.3814507437258796,0.10973593660991035,0.4985579701364264,29308.52
"mp-300771623, Li3Mn3(PO4)4, Li5Mn3(PO4)4, mp-762574, mp-771623",1.0,2.0,-1.2261347996576035,0.10554937512110651,0.49371683732196153,28254.423076923078
"mp-300771627, Mn3V2O10, Li5Mn3V2O10, mp-772479, mp-771627",2.0,2.0,0.0,-0.43682101660752326,0.7451776563034451,329.73333333333335
"mp-300771630, Cr3(FeO4)2, LiCr3(FeO4)2, mp-771791, mp-771630",5.0,6.0,-0.7174592036340744,-0.14832830911383538,0.5918491991103709,27619.615384615383
"mp-300771633, Li2Mn(PO4)2, Li3Mn(PO4)2, mp-762568, mp-771633",2.0,2.0,-1.725664428073306,0.1038539284899637,0.48535028831476446,28302.846153846152
"mp-300771635, LiNbVO4, Li2NbVO4, mp-853154, mp-771635",3.0,8.0,-0.8228608191966452,-0.03356520497364885,0.5138186435069702,25929.0
"mp-300771637, FeClO, LiFe2(ClO)2, mp-552787, mp-771637",3.0,8.0,-0.980297284659849,-0.08131153155331335,0.5072927534330091,16567.666666666668
"mp-300771651, Mn13Fe3O32, Li8Mn13Fe3O32, mp-771188, mp-771651",1.0,4.0,0.0,-0.5721947280795676,0.7785605918946329,358.9791666666667
"mp-300771653, V3Ni(PO4)6, Li6V3Ni(PO4)6, mp-775463, mp-771653",5.0,3.0,-1.5180033889228977,0.12790809910524004,0.4899647018311729,32189.264705882353
"mp-300771655, LiV2CrO6, Li2V2CrO6, mp-849360, mp-849330",1.0,4.0,-1.4050484238587877,-0.12934372171038078,0.4562927618070761,27124.4
"mp-300771655, Li2V2CrO6, Li3V2CrO6, mp-849330, mp-771655",1.0,4.0,-1.1288098836588527,-0.11344206850208927,0.4397402010650909,24808.545454545456
"mp-300771658, LiNiH12(SO7)2, Li2NiH12(SO7)2, mp-781684, mp-771658",1.0,2.0,-0.9566585364032336,0.14189152615746062,0.5133459184561182,21705.7
"mp-300771661, Li2Cr(FeO3)2, Li3Cr(FeO3)2, mp-782631, mp-771661",2.0,2.0,-1.1127739021772318,-0.17170643783472872,0.4979520096131534,24852.636363636364
"mp-300771665, Li4Mn3(NiO4)3, Li2MnNiO4, mp-762625, mp-771665",2.0,2.0,-0.6297245480415289,-0.20713829826121363,0.4709578636192892,24790.909090909092
"mp-300771667, V2NiO6, LiV2NiO6, mp-771872, mp-771667",1.0,4.0,-2.4340920466158282,-0.1313119241374553,0.46716049680567867,30017.666666666668
"mp-300771681, VOF3, LiVOF3, mp-764274, mp-771681",4.0,8.0,-1.6068408917514319,-0.050221737964558866,0.3802463045319817,13545.8
"mp-300771683, TiMn3O8, Li2TiMn3O8, mp-771789, mp-771683",5.0,12.0,-0.7341395360726949,-0.17460421392900763,0.5049642127640789,29942.5
"mp-300771684, Mg2Mn3O8, LiMg2Mn3O8, mp-771763, mp-771684",5.0,6.0,-0.654326651884822,-0.1315561124191187,0.5019032080640751,27671.923076923078
"mp-300771688, Mn3Nb2Cr3O16, Li4Mn3Nb2Cr3O16, mp-771853, mp-771688",2.0,1.0,-1.4397799729018677,-0.15117120249788046,0.4986600818655417,29946.666666666668
"mp-300771711, Li2V3CoO8, Li4V3CoO8, mp-765432, mp-771711",5.0,6.0,-0.534741666224325,-0.13270823310957863,0.45267808752620303,25915.571428571428
"mp-300771719, Li3TiNi3O8, Li4TiNi3O8, mp-763760, mp-771719",1.0,4.0,-0.4933492639891352,-0.2534017723775232,0.45815526605563045,24295.6
"mp-300771720, LiMn2NiO6, Li2Mn2NiO6, mp-762633, mp-762672",2.0,2.0,-1.6504570179764146,-0.22561508610483658,0.47922119927888424,27078.7
"mp-300771720, Li2Mn2NiO6, Li3Mn2NiO6, mp-762672, mp-771720",2.0,2.0,-1.1090205672747322,-0.15748179041152258,0.48163104796488065,24809.545454545456
"mp-300771724, Li2Fe2NiO6, Li3Fe2NiO6, mp-762754, mp-771724",1.0,4.0,-1.1468550294245838,-0.24661126165223665,0.45491580356911704,24800.515151515152
"mp-300771725, Ni3O4, LiNi3O4, mp-714961, mp-771725",1.0,8.0,-1.0276981826321425,-0.323648355695854,0.4903068149773032,25666.14285714286
"mp-300771730, Li2MgNi3O8, Li4MgNi3O8, mp-771786, mp-771730",1.0,4.0,-0.18636302132961585,-0.3644643588462033,0.5142087154359526,25885.5
"mp-300771732, Li2MnBPO7, Li3MnBPO7, mp-772263, mp-771732",1.0,4.0,-1.9575385122095146,-0.011672682211826749,0.4641565115437409,26823.0
"mp-300771739, Mn(SbO3)4, Li3Mn(SbO3)4, mp-773338, mp-771739",2.0,1.0,-0.4820133309652735,0.11982860881628556,0.6629302496068896,31717.352941176472
"mp-300771741, Mn3CuO8, Li2Mn3CuO8, mp-771796, mp-771741",5.0,12.0,0.0,-0.6508652040322158,0.7007312063129598,336.1666666666667
"mp-300771744, Li2FeBPO7, Li3FeBPO7, mp-778767, mp-771744",1.0,4.0,-1.8018623312367985,-0.053050135748647774,0.4468932149796096,26813.583333333332
"mp-300771747, V3FeO8, Li2V3FeO8, mp-771199, mp-771747",1.0,2.0,-2.0955816133175253,-0.13675300871423432,0.4803112488273979,29982.5
"mp-300771757, V3Co3(TeO8)2, Li4V3Co3(TeO8)2, mp-775162, mp-771757",2.0,1.0,-1.524574768416957,-0.08144907711344977,0.5306378684735614,29965.625
"mp-300771784, Mg(NiO2)4, Li3Mg(NiO2)4, mp-771873, mp-771784",5.0,12.0,0.0,-0.5720871323843426,0.7287803417831473,463.6923076923077
"mp-300771785, Co(NiO2)4, Li3Co(NiO2)4, mp-772058, mp-771785",1.0,4.0,-0.23256621465575422,-0.39244767228361255,0.4817191291759618,27579.23076923077
"mp-300771793, Li2Cr3CuO8, Li4Cr3CuO8, mp-765795, mp-771793",5.0,6.0,-0.37470434505489864,-0.28956502951474644,0.45297722279259883,25911.14285714286
"mp-300771803, NbFeO4, LiNbFeO4, mp-771457, mp-771803",4.0,8.0,-1.999616901217083,-0.10041014910390933,0.535223614767309,30040.833333333332
"mp-300771807, Mn3NbO8, Li2Mn3NbO8, mp-771989, mp-771807",1.0,2.0,-1.4747033589503356,-0.12911716099646467,0.4983357152029398,29895.833333333332
"mp-300771812, Li3FeCu3O8, Li4FeCu3O8, mp-771689, mp-771812",2.0,1.0,-0.0463066464422454,-0.2698640130059813,0.7892242052001902,608.5333333333333
"mp-300771840, Li2V2FeO6, Li3V2FeO6, mp-762806, mp-771840",2.0,2.0,-1.1051201915011872,-0.09656578133093582,0.47827758094078315,24829.454545454544
"mp-300771842, Li2Cr2NiO6, Li3Cr2NiO6, mp-853219, mp-771842",1.0,4.0,-1.1021632050561831,-0.2183770000547434,0.4651722539352962,24789.60606060606
"mp-300771850, V(TeO3)4, Li3V(TeO3)4, mp-762679, mp-771850",2.0,1.0,0.0,-1.549628758539766,0.7778301144677411,375.05882352941177
"mp-300771851, Mn3TeO8, Li3Mn3TeO8, mp-774019, mp-771851",2.0,1.0,-0.21659715548647854,0.016691023897208224,0.5664903237155422,29924.166666666668
"mp-300771908, FePO4F, LiFePO4F, mp-772533, mp-771908",3.0,4.0,0.0,-1.2294656571348237,0.8799571132499365,415.0
"mp-300771909, Li2Mn2P4H3O16, Li4Mn2P4H3O16, mp-763324, mp-771909",2.0,1.0,-1.7538897160207245,0.15839604441536773,0.5015660526859382,27326.703703703704
"mp-300771916, NiH8(CO5)2, Li2NiH8(CO5)2, mp-772564, mp-771916",1.0,4.0,-1.189063026835567,0.013310985551922788,0.578553257523229,22088.761904761905
"mp-300771918, LiMn2P2(O4F)2, LiMnPO4F, mp-763273, mp-763235",2.0,1.0,-0.9420177444628023,0.08101378407960007,0.4807670853095355,25424.4
"mp-300771918, LiMnPO4F, Li3Mn2P2(O4F)2, mp-763235, mp-763234",2.0,1.0,-0.7224452714702159,0.07600575619343819,0.47401217478771096,23954.25
"mp-300771918, Li3Mn2P2(O4F)2, Li2MnPO4F, mp-763234, mp-771918",1.0,2.0,-0.6507611149076709,0.06198590708302854,0.46062205511293425,22668.352941176472
"mp-300771919, FeO2, Li(FeO2)2, mvc-12125, mp-770095",5.0,6.0,-0.9086679312516952,-0.33077469648958807,0.5132692163597159,26181.083333333332
"mp-300771919, Li(FeO2)2, LiFeO2, mp-770095, mp-771919",5.0,6.0,0.0,-0.5134036974261981,0.8246047595395944,382.57142857142856
"mp-300771920, Li2Fe3CoO8, Li3Fe3CoO8, mp-762906, mp-767942",1.0,4.0,-0.8119523097261925,-0.23377565744871948,0.48789576571373444,25924.285714285714
"mp-300771920, Li3Fe3CoO8, Li4Fe3CoO8, mp-767942, mp-771920",5.0,12.0,-0.6336815066883911,-0.1820037323937786,0.5011298265730504,24349.866666666665
"mp-300771921, Li3(NiO2)5, Li4(NiO2)5, mp-762930, mp-763806",2.0,2.0,-0.23560143704674497,-0.3658961267462518,0.4812762021004075,25186.833333333332
"mp-300771921, Li4(NiO2)5, LiNiO2, mp-763806, mp-771921",2.0,2.0,-0.9634964248588721,-0.32214969483557265,0.46192254096126817,23957.052631578947
"mp-300771923, Li9(FeO4)2, Li21(FeO4)4, mp-775344, mp-769519",1.0,2.0,-0.4924759226994936,-0.1464834387942482,0.4263972701337616,19725.473684210527
"mp-300771923, Li21(FeO4)4, Li6FeO4, mp-769519, mp-771923",2.0,1.0,-0.4431294434249441,-0.09624893452718201,0.4483713877368502,18432.878048780487
"mp-300771942, Mn5O8, Li3Mn5O8, mp-761290, mp-771942",5.0,12.0,0.0,-0.3346281900015476,0.7810647631562152,337.53846153846155
"mp-300771969, LiCuCSO7, Li2CuCSO7, mp-768599, mp-771969",1.0,2.0,-2.739201159762332,-0.2090207041149853,0.5218638031389382,28782.18181818182
"mp-300771986, Li3Fe3O8, Li4Fe3O8, mp-763690, mp-771986",2.0,1.0,0.0,-0.5988027087838045,0.7521773713684642,359.07142857142856
"mp-300771987, MnV4O12, Li3MnV4O12, mp-762803, mp-771987",2.0,1.0,-0.4819560932394547,-0.13620932669887897,0.4562427171236915,31743.0
"mp-300771991, Li5NiO4, Li6NiO4, mp-775354, mp-771991",3.0,4.0,-0.384294156528219,-0.17350568414627876,0.41856497649604113,18805.9
"mp-300771995, Li2(FeO2)5, Li4(FeO2)5, mp-762529, mp-762455",2.0,2.0,0.0,-0.5447547737273857,0.8349418442902984,389.3529411764706
"mp-300771995, Li4(FeO2)5, LiFeO2, mp-762455, mp-771995",2.0,1.0,-0.16579755086372325,-0.16442275948257842,0.48659560227251,24059.57894736842
"mp-300771997, Li3MnCu3O8, Li4MnCu3O8, mp-780643, mp-771997",1.0,4.0,-0.16994316052957756,-0.4752942327018699,0.40862966726870553,24253.933333333334
"mp-300772003, Co7O12, Li5Co7O12, mp-771737, mp-772003",1.0,2.0,-1.1970490113285999,-0.2297214209877215,0.6521801066444644,28306.42105263158
"mp-300772021, LiMn5O10, Li3Mn5O10, mp-763699, mp-763693",2.0,2.0,-1.7233794074656272,-0.1757320470975182,0.4942610024732511,28147.9375
"mp-300772021, Li3Mn5O10, Li4Mn5O10, mp-763693, mp-763777",2.0,2.0,-0.3119211311570273,-0.156107893208793,0.48075294852737227,25231.722222222223
"mp-300772021, Li4Mn5O10, LiMnO2, mp-763777, mp-772021",2.0,2.0,-0.9800361352889155,-0.14784509157143502,0.4750653468659496,24003.842105263157
"mp-300772030, TiO2, Li3Ti4O8, mvc-11115, mp-761891",5.0,6.0,-1.1538919338474256,-0.1358972374237706,0.5127593465339803,30077.0
"mp-300772030, Li3Ti4O8, LiTiO2, mp-761891, mp-772030",2.0,1.0,-0.795285114955528,-0.08485229365124178,0.46587605050194386,24307.0
"mp-300772068, Co4TeO8, Li3Co4TeO8, mp-780537, mp-772068",1.0,4.0,-0.27233603634815434,0.04418440260222578,0.6469308435662865,27638.69230769231
"mp-300772084, Cu3(P2O7)2, Li5Cu6(P2O7)4, mp-772942, mp-772084",2.0,2.0,-1.7433677621502026,-0.03951764074516434,0.46183545122437847,30469.666666666668
"mp-300772122, LiV4CuO12, Li3V4CuO12, mp-772248, mp-772122",1.0,2.0,-2.4040359199973405,-0.2190001977592932,0.43276728822684274,30072.777777777777
"mp-300772150, Ti13O22, Li2Ti13O22, mp-656852, mp-772150",3.0,8.0,-0.9366023889663476,-0.08964234211480528,0.4974026252395181,28271.514285714286
"mp-300772208, Co3SbO8, Li3Co3SbO8, mp-765847, mp-772208",5.0,12.0,0.0,-0.911349729032417,0.8281794391880316,448.75
"mp-300772224, Ti3MnCr(PO4)6, LiTi3MnCr(PO4)6, mp-772341, mp-772224",5.0,3.0,-1.5126618878812548,0.1183552077894275,0.509653894454673,31297.17142857143
"mp-300772233, Li2VGa3O8, Li4VGa3O8, mp-771679, mp-772233",2.0,1.0,-1.493119445351229,-0.12269418343715174,0.447557294276362,26018.785714285714
"mp-300772240, MnH4(SO5)2, LiMnH4(SO5)2, mp-772662, mp-771543",1.0,4.0,-1.2117728638985288,0.10774193941335244,0.5203662404133093,26825.117647058825
"mp-300772240, LiMnH4(SO5)2, Li2MnH4(SO5)2, mp-771543, mp-772240",1.0,2.0,-1.0732110348008348,0.10180546155155558,0.5121619224437001,25440.5
"mp-300772244, Li4Ti3(FeO4)3, Li2TiFeO4, mp-762695, mp-772244",2.0,2.0,-0.5443370308321036,-0.1016933973669958,0.5173266030361584,24905.5
"mp-300772250, Li6FeO6, Li8FeO6, mp-772347, mp-772250",2.0,2.0,0.0,-0.4923522229963544,0.6010186770317896,287.61538461538464
"mp-300772251, Mn4NiO8, Li3Mn4NiO8, mp-773257, mp-772251",1.0,4.0,-0.8601436768280547,-0.17320177217771598,0.5115292914894464,27649.0
"mp-300772256, VPO5, LiVPO5, mp-770892, mp-772256",3.0,4.0,-1.9555012025726988,0.09557670209763725,0.4802252997322639,32491.714285714286
"mp-300772283, Cr3SbO8, Li2Cr3SbO8, mp-773170, mp-772283",1.0,2.0,-1.4038619591376067,-0.11396590426469089,0.5495185780248621,29923.25
"mp-300772298, Ti2Ni(PO5)2, LiTi2Ni(PO5)2, mp-772218, mp-772298",1.0,4.0,-2.76966861989831,0.07292813487839198,0.5170084040084174,30371.133333333335
"mp-300772320, LiCoSiO4, Li2CoSiO4, mp-763589, mp-772320",3.0,4.0,-0.988593203640462,0.011215003473577845,0.5971605237655995,26195.14285714286
"mp-300772345, Li5Mn6O16, Li3Mn3O8, mp-764823, mp-33461",2.0,1.0,0.0,-0.5439144557279811,0.6766690888006264,315.85185185185185
"mp-300772345, Li3Mn3O8, Li4Mn3O8, mp-33461, mp-772345",5.0,12.0,0.0,-0.5047556217086184,0.669400331272592,310.0
"mp-300772348, Li11(FeO3)4, Li3FeO3, mp-849463, mp-772348",1.0,2.0,-1.3102873074527364,-0.1413213711780798,0.447193977083479,20687.40740740741
"mp-300772356, V3Cr3(WO8)2, Li4V3Cr3(WO8)2, mp-775969, mp-772356",2.0,1.0,-1.4685495443112127,-0.06839203523688082,0.4839862295541755,29955.0
"mp-300772366, Fe(SO4)2, LiFe(SO4)2, mp-771582, mp-772366",5.0,3.0,0.0,-1.386229283119215,0.8444569159542179,493.0
"mp-300772371, LiCoCSO7, Li2CoCSO7, mp-773196, mp-772371",1.0,2.0,-2.741330810765078,-0.04240339372770556,0.6119134446132315,28787.636363636364
"mp-300772380, V(SO4)2, LiV(SO4)2, mp-771598, mp-772380",5.0,3.0,-1.765966381590622,0.04350106923661065,0.5096393892183588,32673.363636363636
"mp-300772402, Mn5Cr3O16, Li4Mn5Cr3O16, mp-771553, mp-772402",1.0,2.0,-1.418189455224183,-0.1994990041276196,0.5377918385230984,29897.916666666668
"mp-300772420, Co3SnO8, Li2Co3SnO8, mp-772446, mp-772420",1.0,2.0,-1.5795360134164689,-0.3070191115131082,0.5213359384086722,29892.083333333332
"mp-300772425, LiV(SO4)3, Li3V(SO4)3, mp-772428, mp-772425",2.0,1.0,-2.708236796909608,0.04450936639298014,0.4976726029487332,31827.823529411766
"mp-300772427, Li2Fe(PO4)2, Li3Fe(PO4)2, mp-762856, mp-772427",1.0,2.0,0.0,-1.219195612324013,0.8833100782887365,421.7692307692308
"mp-300772438, CoPO4, LiCoPO4, mp-777906, mp-772438",1.0,4.0,-1.9313788923420168,0.15035145716864115,0.6214567148161095,30370.833333333332
"mp-300772451, MnPO4, Li2Mn3(PO4)3, mp-773411, mp-772451",5.0,12.0,-1.4060431451631856,0.11610811207318585,0.5128662921098931,30398.0
"mp-300772516, CoPO4, LiCoPO4, mp-771533, mp-772516",1.0,4.0,-2.141470847125937,0.15035145716864115,0.6214567148161095,30370.833333333332
"mp-300772517, Li3Fe2(PO4)3, Li7Fe4(PO4)6, mp-773942, mp-772517",1.0,2.0,-1.3338314124546091,0.10692059783873598,0.49862786117293767,27640.65
"mp-300772552, Li2CrO4, Li3CrO4, mp-769767, mp-770632",3.0,4.0,-1.6888675478884527,-0.1891599794675526,0.46733678601107104,26113.428571428572
"mp-300772552, Li3CrO4, Li4CrO4, mp-770632, mp-772434",3.0,4.0,-1.011533575075685,-0.1455474991210559,0.49603889208889135,23062.125
"mp-300772552, Li4CrO4, Li6CrO4, mp-772434, mp-772552",3.0,8.0,-0.6382726591233133,-0.16224714982927996,0.4347128486942733,20695.666666666668
"mp-300772561, CuSb(PO4)2, Li2CuSb(PO4)2, mp-755148, mp-772561",1.0,4.0,-2.2725039227415973,0.2248143193839737,0.5433585404542505,30464.083333333332
"mp-300772578, Mn3SnO8, Li2Mn3SnO8, mp-771670, mp-772578",6.0,12.0,-1.494489768645649,-0.1523194013785422,0.5086319331574921,29919.333333333332
"mp-300772603, LiVAsCO7, Li2VAsCO7, mp-771935, mp-772603",1.0,2.0,-2.5214179936353016,-0.01869634217317045,0.5525748413371451,28805.0
"mp-300772661, MnSn3(PO4)4, Li4MnSn3(PO4)4, mp-771800, mp-772661",1.0,2.0,-2.1986774377502636,0.07930394936775036,0.5277162843550723,30294.625
"mp-300772668, Li2MnSiCO7, Li3MnSiCO7, mp-770080, mp-772668",1.0,4.0,-1.8906261070572108,-0.08239260023224441,0.5383893368668459,26698.333333333332
"mp-300772671, Li2CrO4, Li5CrO4, mp-773996, mp-772671",1.0,2.0,-1.3971193144982799,-0.18915997946755267,0.46733678601107104,26113.428571428572
"mp-300772680, Co5NiO12, Li4Co5NiO12, mp-773511, mp-772680",1.0,4.0,-1.0755388310169243,-0.4168327776762843,0.5252237761623714,29861.11111111111
"mp-300772687, Cr3Ni(SO4)6, LiCr3Ni(SO4)6, mp-776858, mp-767547",5.0,3.0,-2.0396835370252098,0.023437734487434882,0.5058994313942451,31722.852941176472
"mp-300772687, LiCr3Ni(SO4)6, Li2Cr3Ni(SO4)6, mp-767547, mp-772687",2.0,1.0,-1.9545898761849518,0.03773526111698293,0.5058945772065478,30877.0
"mp-300772690, Mn4CoO8, Li3Mn4CoO8, mp-770056, mp-772690",1.0,4.0,-0.9975340527427669,-0.17276943038886114,0.498312724485645,27643.30769230769
"mp-300772701, Fe(SbO3)4, Li3Fe(SbO3)4, mp-770991, mp-772701",2.0,1.0,-0.43341230119523755,0.09062099455500021,0.6507443932086792,31710.70588235294
"mp-300772721, Si6Bi9O26, LiSi6Bi9O26, mp-775315, mp-772721",2.0,1.0,0.0,-1.2192472711197984,1.016434311254724,422.0243902439024
"mp-300772731, Co3TeO8, Li2Co3TeO8, mp-761512, mp-772731",5.0,12.0,-0.732528155835374,-0.2564881854025491,0.5055416962609568,29908.333333333332
"mp-300772741, Mn3SnO8, Li2Mn3SnO8, mp-850479, mp-772741",5.0,12.0,-0.8015504343834849,-0.15231940137854225,0.5086319331574922,29919.333333333332
"mp-300772826, KTiAsO5, K2LiTi2(AsO5)2, mp-6488, mp-772826",3.0,4.0,-1.2636031441041715,0.04347747447245531,0.5109310938512397,28526.25
"mp-300772829, Ba6Ti7(Sb3O14)3, Ba6Li2Ti7(Sb3O14)3, mp-773058, mp-772829",1.0,2.0,-1.1953053741803836,0.025856159125516753,0.603311344563044,29734.296875
"mp-300772997, Li2Ti7Nb6O30, Li8Ti7Nb6O30, mp-759382, mp-772997",5.0,3.0,0.3480347710340994,-0.10175606074412183,0.5096265383362619,30112.777777777777
"mp-300773049, KNb2O5, K3LiNb6O15, mp-773070, mp-773049",1.0,2.0,-1.6035146768019213,-0.03331501153753356,0.48348508893395176,28462.0
"mp-300773055, Li2Mg3Ti6O16, Li3Mg3Ti6O16, mp-758770, mp-773055",1.0,2.0,-0.7346814057510564,-0.10304180711055494,0.49772808944884134,26877.74074074074
"mp-300773072, Ba8Nb7O24, Ba8LiNb7O24, mp-780569, mp-773072",1.0,2.0,0.19760041973103012,-0.0687709756277634,0.5116001495751067,28111.46153846154
"mp-300773078, LiCa2Nb3O10, Li7Ca8Nb12O40, mp-766983, mp-773078",2.0,2.0,-0.847095341047271,-0.08908446142421728,0.5036040904634942,28372.4375
"mp-300773081, Li2Ti6Zn3O16, Li3Ti6Zn3O16, mp-759849, mp-773081",1.0,2.0,-0.7244938285587513,-0.14734743087394808,0.4672031766015659,26971.51851851852
"mp-300773084, Ba6Ti7Nb9O42, Ba6Li2Ti7Nb9O42, mp-773061, mp-773084",1.0,2.0,-1.1695996427094735,-0.09725142123800964,0.5163024509993519,29756.1875
"mp-300773087, MgSi4(CuO6)2, Li2MgSi4(CuO6)2, mp-756830, mp-773087",2.0,2.0,-1.6519130168203593,-0.12360921086364977,0.4986659811888025,28814.684210526317
"mp-300773089, KNb2PO8, K3Li2Nb6(PO8)3, mp-773047, mp-773089",5.0,3.0,-2.1151986674351666,0.03878518973722383,0.502947485719647,30458.666666666668
"mp-300773098, Mn3VO8, Li4Mn3VO8, mp-771844, mp-773098",2.0,2.0,-0.21382848522753042,-0.17552643926325914,0.4941511005152294,29905.833333333332
"mp-300773118, Ba6Ta9Ti7O42, Ba6Li2Ta9Ti7O42, mp-773060, mp-773118",1.0,2.0,-1.1990497401769322,-0.08789399987645091,0.4900293565676054,29737.671875
"mp-300773176, LiCrAsCO7, Li2CrAsCO7, mp-770129, mp-773176",2.0,1.0,-2.344588888723583,-0.058470952644283966,0.5613259471931881,28787.909090909092
"mp-300773184, LiMnSnO4, Li2MnSnO4, mp-770037, mp-773184",3.0,8.0,-0.7862311812956547,-0.10027260600813961,0.49458238654365416,25935.428571428572
"mp-300773195, NiSn(PO4)2, Li2NiSn(PO4)2, mp-763591, mp-773195",1.0,4.0,-2.1447918270924284,0.14741929050439806,0.5217383887704402,30421.5
"mp-300773211, Li2FeSiCO7, Li3FeSiCO7, mp-772473, mp-773211",1.0,4.0,-1.9770134696279986,-0.12377005376906543,0.5211260403027145,26688.916666666668
"mp-300773213, Li2Fe(BO3)2, Li3Fe(BO3)2, mp-767828, mp-773213",1.0,4.0,-0.9517649595019991,-0.1933431714450201,0.42027663365347867,25063.81818181818
"mp-300773222, Li3Cr2Fe5O12, Li4Cr2Fe5O12, mp-780009, mp-850397",1.0,2.0,-0.6995632334498098,-0.13132385290331605,0.5007210366474298,24823.0
"mp-300773222, Li4Cr2Fe5O12, Li5Cr2Fe5O12, mp-850397, mp-773222",1.0,2.0,-0.5603897022449951,-0.10237247139377262,0.5140513078767142,23811.739130434784
