,Crystal System,symmetry ops,ShannonForce,meanbv,stdbv,meanValenceOcc
"mp-300002074, Sb, Li3Sb, mp-10631, mp-2074",4.0,16.0,0.0,-2.2100265807616717,1.6518798738549583,577.0
"mp-300003731, Li17Nb20O60, Li17Nb18O54, mp-686160, mp-530514",2.0,1.0,0.0,-0.43509217889729895,0.6930928283816178,306.22680412371136
"mp-300003731, Li17Nb18O54, LiNbO3, mp-530514, mp-3731",2.0,1.0,0.0,-0.41622743026011333,0.6888915562959762,303.2808988764045
"mp-300003924, NbO2, LiNb2O4, mp-25214, mp-758673",5.0,12.0,-1.9835423455799044,0.046050974306401336,0.4862453562894242,29890.333333333332
"mp-300003924, LiNb2O4, Li7Nb12O24, mp-758673, mp-766084",2.0,1.0,0.0,-0.11226695969346737,0.7470546162459243,297.42857142857144
"mp-300003924, Li7Nb12O24, LiNbO2, mp-766084, mp-3924",2.0,1.0,0.0,-0.09680649791421969,0.7406845990777791,294.04651162790697
"mp-300004226, CrS2, LiCrS2, mp-755263, mp-4226",1.0,4.0,-1.6779188983813595,-0.08573035228906623,0.5072181814196638,3819.6666666666665
"mp-300004711, Li4(CuO2)3, Li5(CuO2)3, mp-752615, mp-760590",2.0,1.0,-1.047809494376711,-0.4180779996167717,0.42065536401571324,17908.53846153846
"mp-300004711, Li5(CuO2)3, Li2CuO2, mp-760590, mp-4711",2.0,1.0,-0.48530802876002177,-0.33793731355372536,0.4110764127643746,16813.285714285714
"mp-300005127, CuO, Li3(CuO)4, mp-25229, mp-753081",4.0,16.0,-1.8738432828406117,-0.5915502051566236,0.3117580786958009,22809.0
"mp-300005127, Li3(CuO)4, LiCuO, mp-753081, mp-5127",1.0,2.0,-0.30100035920606383,-0.1406127615178509,0.41860351882560154,13028.818181818182
"mp-300006944, TiO2, Li3Ti8O16, mp-25262, mp-531914",7.0,48.0,-0.867932567087307,-0.1358972374237708,0.51275934653398,30077.0
"mp-300006944, Li3Ti8O16, Li7Ti16O32, mp-531914, mp-530141",3.0,8.0,0.0,-0.33168696783328094,0.7101274824489421,312.0
"mp-300006944, Li7Ti16O32, LiTi2O4, mp-530141, mp-5670",3.0,4.0,0.0,-0.3156102430215089,0.7058186896410643,309.09090909090907
"mp-300006944, LiTi2O4, LiTiO2, mp-5670, mp-6944",7.0,48.0,0.0,-0.30010768695301465,0.7016637822906105,306.2857142857143
"mp-300007543, VS2, LiVS2, mp-9561, mp-7543",5.0,12.0,-1.6937695776528512,0.06010988610501652,0.47513079328083946,3882.3333333333335
"mp-300007936, NbS2, Li9(NbS2)14, mp-10033, mp-767218",6.0,24.0,-0.2670041166544822,0.2457469991721942,0.49186925203168114,3842.3333333333335
"mp-300007936, Li9(NbS2)14, Li5(NbS2)7, mp-767218, mp-767171",2.0,1.0,0.0,0.49297842259140934,1.2825358460278948,575.0196078431372
"mp-300007936, Li5(NbS2)7, LiNbS2, mp-767171, mp-7936",2.0,1.0,-0.5764472299486837,0.28333453874838405,0.5162361366388715,3433.8076923076924
"mp-300007955, Sb, Li3Sb, mp-80, mp-7955",6.0,24.0,0.0,-2.2100265807616717,1.6518798738549583,577.0
"mp-300009158, CuO2, LiCuO2, mp-704672, mp-9158",3.0,4.0,0.06720971642977977,-0.6789598951469062,0.7911589391346271,345.6666666666667
"mp-300009615, TiS2, LiTiS2, mp-2156, mp-9615",5.0,12.0,-1.7101118039997378,0.0637987874420222,0.518383242276237,4029.0
"mp-300010179, MgSbPd, LiMgSbPd, mp-10183, mp-10179",7.0,24.0,0.0,0.07557170030816247,1.090928528172656,238.66666666666666
"mp-300010189, TiTe2, LiTiTe2, mp-1907, mp-10189",5.0,12.0,-1.5391266352079567,0.15724099223267748,0.7938524560556091,721.0
"mp-300011206, Ti(SiO3)2, LiTi(SiO3)2, mp-25301, mp-11206",1.0,4.0,-2.2621858570141593,0.05129630622175737,0.5373186952089316,30455.444444444445
"mp-300016730, CrS2, Li(CrS2)2, mvc-14769, mvc-16730",2.0,1.0,-0.5408001122432726,-0.08573035228906627,0.5072181814196637,3819.6666666666665
"mp-300016742, MnS2, Li(MnS2)2, mvc-34, mvc-16742",2.0,1.0,-0.5901226440814651,0.012189485435039468,0.5079897305830351,3849.6666666666665
"mp-300018162, CuO, Li(CuO)2, mp-510752, mp-18162",3.0,8.0,-1.5345400301550032,-0.5915502051566236,0.3117580786958009,22809.0
"mp-300018274, Ba4Nb3O12, Ba4LiNb3O12, mp-774719, mp-18274",1.0,2.0,0.0,-0.41048642132710994,0.7357939794268865,309.7368421052632
"mp-300018713, Ba2(CuO2)3, Ba2Li(CuO2)3, mp-25225, mp-18713",3.0,8.0,-0.3728213816139527,-0.3419122928914112,0.6502316836502013,8847.727272727272
"mp-300018722, Cs2MnO4, Cs2LiMnO4, mp-775233, mp-18722",3.0,4.0,-2.9677929868092714,-0.18815824185241464,0.39145604673542894,25943.285714285714
"mp-300018767, MnO2, LiMnO2, mp-33009, mp-18767",3.0,8.0,-1.8630357071976242,-0.18750653943075327,0.5023658348407783,29897.666666666668
"mp-300018782, FeO2, Li(FeO2)3, mp-25517, mp-762931",4.0,16.0,-1.3165635290814115,-0.35301635357803735,0.43331264858425306,29860.0
"mp-300018782, Li(FeO2)3, LiFeO2, mp-762931, mp-18782",2.0,2.0,-0.9389573199588134,-0.2634343963826944,0.4586220515861751,27104.8
"mp-300018793, CrO2, Li3Cr5O10, mp-714929, mp-762282",2.0,1.0,-0.9086184396733403,-0.28542637715485913,0.5015942856774069,29867.666666666668
"mp-300018793, Li3Cr5O10, Li3Cr4O8, mp-762282, mp-771288",2.0,2.0,-1.0536509522110309,-0.17112885647481138,0.45817913403234684,25232.88888888889
"mp-300018793, Li3Cr4O8, LiCrO2, mp-771288, mp-18793",5.0,12.0,-0.3610173605872957,-0.1482693523388018,0.44949610370333487,24305.933333333334
"mp-300018809, LiVGeO5, Li2VGeO5, mp-853190, mp-18809",1.0,4.0,-1.7562209173075058,-0.06762008872494768,0.4538930450467313,28368.75
"mp-300018860, LiVSiO5, Li2VSiO5, mp-774113, mp-18860",1.0,4.0,-1.971328162803522,-0.019320850501667708,0.4766200594485483,28572.875
"mp-300018878, FeAs2O7, LiFeAs2O7, mp-25524, mp-18878",1.0,2.0,-3.6865348423302007,0.07869172727777976,0.5233800602065394,31453.1
"mp-300018915, CoPO4, LiCoPO4, mp-510669, mp-18915",3.0,8.0,-2.286814611209278,0.15035145716864093,0.6214567148161094,30370.833333333332
"mp-300018925, Li4CoO4, Li5CoO4, mp-776004, mp-775093",1.0,2.0,-0.735348875884151,-0.19836263064771842,0.4406162563048105,20693.555555555555
"mp-300018925, Li5CoO4, Li6CoO4, mp-775093, mp-18925",1.0,2.0,-0.36634236742029663,-0.09601194268174618,0.49389613389362114,18809.0
"mp-300018932, Pr(WO4)2, LiPr(WO4)2, mp-25655, mp-18932",2.0,2.0,0.0,-0.8154873120846371,0.7643240501052109,298.45454545454544
"mp-300018934, V2O5, LiV2O5, mp-25620, mp-18934",3.0,8.0,-3.0972673126061947,-0.125217066827763,0.44635919189860146,32138.428571428572
"mp-300018939, Co(CO)4, LiCo(CO)4, mp-543072, mp-18939",7.0,24.0,-0.5361944772351015,-0.2562113695825612,0.7332443018261317,19914.444444444445
"mp-300018951, FePO4, LiFePO4, mp-25527, mp-18951",3.0,4.0,-0.7147084525958498,0.12367285174527441,0.530626059255486,30446.833333333332
"mp-300018968, LiFeSiO4, Li2FeSiO4, mp-767283, mp-18968",2.0,1.0,-1.8138896478314257,-0.01165237260359353,0.5193056761422079,26260.285714285714
"mp-300018987, MoP2O7, LiMoP2O7, mp-25577, mp-18987",1.0,2.0,-2.9176570087091886,0.24319613268897705,0.5683566496832029,31953.7
"mp-300018988, Li13Mn8O24, Li2MnO3, mp-763602, mp-18988",2.0,1.0,0.0,-0.47059133303726186,0.6423678881529064,297.24444444444447
"mp-300018997, MnPO4, LiMnPO4, mp-540007, mp-18997",3.0,8.0,-2.259387492764659,0.11610811207318565,0.5128662921098932,30398.0
"mp-300019013, V2O5, LiV2O5, mp-510748, mp-19013",3.0,16.0,-3.08246935087653,-0.12521706682776307,0.44635919189860157,32138.428571428572
"mp-300019017, LiFe4(PO4)4, LiFePO4, mp-632692, mp-19017",2.0,1.0,-1.9828649354887236,0.1401082545481108,0.541693707882105,29291.52
"mp-300019043, V(SiO3)2, LiV(SiO3)2, mp-25633, mp-19043",1.0,4.0,-2.32086618327773,0.05006667244275547,0.5229012122104656,30406.555555555555
"mp-300019107, MnVO4, LiMnVO4, mp-25559, mp-19107",3.0,8.0,-3.140945485292669,-0.14148461833978102,0.4733558329706204,29985.833333333332
"mp-300019131, MnBO3, Li2Mn3(BO3)3, mp-510766, mp-849566",1.0,2.0,-2.377447597057172,-0.1587049168944669,0.4675044286184623,27265.4
"mp-300019131, Li2Mn3(BO3)3, LiMnBO3, mp-849566, mp-19131",2.0,1.0,-0.7820404224406367,-0.15913159475200314,0.44148980646529123,24304.058823529413
"mp-300019183, NiO2, Li2NiO2, mp-714876, mp-19183",1.0,4.0,-2.1062385033962348,-0.5321325680068326,0.5548201144291368,29860.0
"mp-300019206, La4CoO8, LiLa4CoO8, mp-25479, mp-19206",3.0,8.0,-1.311938611374743,-0.2086561701068166,0.49084954655970026,27818.0
"mp-300019279, MnO2, LiMnO2, mp-25558, mp-25542",5.0,6.0,-1.8477074481962403,-0.18750653943075335,0.5023658348407783,29897.666666666668
"mp-300019279, LiMnO2, Li2MnO2, mp-25542, mp-19279",1.0,2.0,-0.816960359265153,-0.14040857009781282,0.4699465053706693,22898.75
"mp-300019308, NiO2, Li2(NiO2)5, mp-543096, mp-762387",1.0,2.0,-1.7834555010197595,-0.5321325680068326,0.5548201144291367,29860.0
"mp-300019308, Li2(NiO2)5, LiNiO2, mp-762387, mp-25587",2.0,1.0,-0.9389999944203715,-0.4147891977052462,0.5029067645500337,26561.29411764706
"mp-300019308, LiNiO2, Li2NiO2, mp-25587, mp-19308",2.0,1.0,-0.9311822146517011,-0.28277790611596143,0.44450424593604293,22850.25
"mp-300019338, MoO2, LiMoO2, mp-714883, mp-19338",1.0,8.0,-2.5349479823985934,0.07245600990950403,0.6949755479568487,29874.0
"mp-300019340, VO2, Li2V3O6, mp-714944, mp-762271",2.0,2.0,-2.7958886680586987,-0.13958613876077627,0.46950689753858255,29930.333333333332
"mp-300019340, Li2V3O6, LiVO2, mp-762271, mp-19340",1.0,4.0,-1.947384664989279,-0.08329235725581106,0.43556790410990337,24797.363636363636
"mp-300019377, La2MoO6, LiLa2MoO6, mp-25581, mp-19377",1.0,4.0,-1.7693362927726408,-0.08684083895901759,0.4678686670933405,30107.11111111111
"mp-300019408, V2O5, LiV2O5, mp-25643, mp-19408",3.0,8.0,-2.7521226352346377,-0.12521706682776307,0.44635919189860157,32138.428571428572
"mp-300019431, YMo3O8, LiYMo3O8, mp-25579, mp-19431",2.0,1.0,0.0,-0.3929536928748343,0.8113092392232831,296.1666666666667
"mp-300019433, ScMo3O8, LiScMo3O8, mp-632694, mp-19433",2.0,1.0,0.0,-0.39715013228511625,0.7962321824563352,299.5
"mp-300019445, La4NiO8, LiLa4NiO8, mp-543085, mp-19445",3.0,8.0,-1.344973229340171,-0.24058534281373767,0.4990454556181892,27817.69230769231
"mp-300019492, Mn(PO3)3, LiMn(PO3)3, mp-25697, mp-19492",3.0,4.0,-2.106837978476464,0.2239416899692595,0.5135259696631419,31715.615384615383
"mp-300019511, Li15(FeO4)4, Li35(FeO4)8, mp-767924, mp-853186",1.0,2.0,0.0,-0.4368547967502925,0.6384287621610009,298.85714285714283
"mp-300019511, Li35(FeO4)8, Li5FeO4, mp-853186, mp-19511",2.0,1.0,-0.5759260244070109,-0.15567392755651008,0.42293047802083217,19957.706666666665
"mp-300019615, V2(PO4)3, LiV2(PO4)3, mp-32518, mp-540147",1.0,4.0,-2.091937051792026,0.14499245856249363,0.4922786849237106,32185.176470588234
"mp-300019615, LiV2(PO4)3, Li2V2(PO4)3, mp-540147, mp-32521",1.0,4.0,-1.8216443970682417,0.12963260049597214,0.4898282977765434,30478.833333333332
"mp-300019615, Li2V2(PO4)3, Li3V2(PO4)3, mp-32521, mp-19615",1.0,4.0,-1.5498281047202842,0.13175876149705432,0.4789343049294015,28964.105263157893
"mp-300019616, Na2Fe(Si2O5)3, Na2LiFe(Si2O5)3, mp-851041, mp-19616",3.0,8.0,0.0,-1.5422801833771766,1.0676523245468967,543.9166666666666
"mp-300019623, VAsO5, LiVAsO5, mp-543108, mp-19623",3.0,8.0,-3.184028147586939,0.06924620469411202,0.5041697856859175,32137.14285714286
"mp-300019667, Ni2P3O10, LiNi2P3O10, mp-25610, mp-19667",1.0,4.0,0.0,-1.3964750708590903,0.9601384860728859,511.8
"mp-300019682, Fe(WO4)2, LiFe(WO4)2, mp-25537, mp-19682",1.0,4.0,0.0,-0.8428279620975812,0.7881767629635665,331.72727272727275
"mp-300021471, Li19(FeAs)20, LiFeAs, mp-530480, mp-21471",2.0,1.0,0.0,0.061828760343573055,1.305366877621564,330.64406779661016
"mp-300021496, La4CuO8, LiLa4CuO8, mp-772213, mp-21496",1.0,4.0,-1.2962804325560695,-0.2744685721537546,0.5535851843963793,21006.69230769231
"mp-300022902, Bi, LiBi, mp-567597, mp-22902",7.0,96.0,0.0,1.2098729425694188,1.3559971079771305,75.0
"mp-300024850, CoO2, Li(CoO2)4, mp-715480, mp-780888",1.0,8.0,-2.9932760604563775,-0.3937728196101746,0.5193045085090184,29861.333333333332
"mp-300024850, Li(CoO2)4, Li3(CoO2)4, mp-780888, mp-853206",5.0,12.0,-0.6564681861381879,-0.3000099681776992,0.5542360872539338,27706.46153846154
"mp-300024850, Li3(CoO2)4, LiCoO2, mp-853206, mp-24850",5.0,12.0,-0.6562373433941887,-0.14998940588573867,0.6101266132457984,24258.666666666668
"mp-300024979, Fe(GeO3)2, LiFe(GeO3)2, mvc-8638, mp-24979",1.0,4.0,0.0,-0.8004411240483432,0.8556320645905,338.3333333333333
"mp-300025044, MnAsO4, LiMnAsO4, mp-543097, mp-25044",3.0,8.0,-2.0045961694761227,0.08538919843573978,0.5408015257224891,29984.333333333332
"mp-300025083, Mo3P3O16, LiMo3P3O16, mp-25669, mp-25083",2.0,2.0,-2.1850205577814092,0.15983328372098052,0.48206231247920783,33036.045454545456
"mp-300025372, CuO2, LiCuO2, mp-25378, mp-25372",5.0,12.0,-0.5144281285148155,-0.6789598951469061,0.7911589391346271,345.6666666666667
"mp-300025385, CuO2, Li(CuO2)2, mp-504100, mp-25385",7.0,48.0,-0.21656524091972995,-0.6789598951469059,0.7911589391346269,345.6666666666667
"mp-300025401, TiPO4F, LiTiPO4F, mp-25436, mp-25420",2.0,2.0,-2.335420456927553,0.10885551680963486,0.4929413452029929,27181.428571428572
"mp-300025401, LiTiPO4F, Li2TiPO4F, mp-25420, mp-25401",2.0,2.0,-1.6365277289794327,0.11016451238828961,0.4661165353493436,23937.125
"mp-300025405, CuPO4F, LiCuPO4F, mp-25380, mp-25405",2.0,2.0,0.0,-1.348654815683975,0.7327391360463277,367.7142857142857
"mp-300025417, TiO2, Li2Ti3O6, mvc-11600, mp-760539",5.0,12.0,-0.21367307562107687,-0.13589723742377066,0.5127593465339801,30077.0
"mp-300025417, Li2Ti3O6, LiTiO2, mp-760539, mp-25417",1.0,4.0,-1.6541197215546337,-0.08949274308510814,0.47013816832303806,24831.545454545456
"mp-300025456, LiCuPCO7, Li2CuPCO7, mp-25466, mp-25456",1.0,2.0,0.0,-1.4182418441858757,0.85763252700397,453.1818181818182
"mp-300025462, LiTiPCO7, Li2TiPCO7, mp-25418, mp-25400",1.0,2.0,-2.7577078388867617,-0.0009345070971984852,0.5491335636381105,29070.636363636364
"mp-300025462, Li2TiPCO7, Li3TiPCO7, mp-25400, mp-25462",1.0,4.0,-2.0624231595158613,0.009087325280807468,0.5265676721994178,26750.333333333332
"mp-300025488, CoPO4F, LiCoPO4F, mp-25473, mp-25487",2.0,2.0,-2.320571133768257,-0.0016625898416811375,0.4957464146208665,27089.0
"mp-300025488, LiCoPO4F, Li2CoPO4F, mp-25487, mp-25488",2.0,2.0,-1.5626469221885895,0.10168826501502948,0.555454991817373,23933.875
"mp-300025490, LiCoPCO7, Li2CoPCO7, mp-633471, mp-25482",1.0,2.0,-2.4333139218916133,-0.07126421132985411,0.5509186078131209,29011.81818181818
"mp-300025490, Li2CoPCO7, Li3CoPCO7, mp-25482, mp-25490",1.0,4.0,-2.068572057929044,0.003436493698634043,0.5861266431781041,26748.166666666668
"mp-300025507, CrPO4, LiCrPO4, mp-31750, mp-25507",3.0,8.0,-2.1276911673135728,0.1337270947152025,0.49054966066932487,30409.166666666668
"mp-300025508, CrPO4F, LiCrPO4F, mp-849535, mp-25501",2.0,2.0,-2.205153096538698,0.04477159978202543,0.48815631912160434,27091.714285714286
"mp-300025508, LiCrPO4F, Li2CrPO4F, mp-25501, mp-25508",2.0,2.0,-1.5222649397809567,0.08921999317495066,0.45727470120728464,23962.625
"mp-300025510, Li3Cr2P2(CO7)2, Li2CrPCO7, mp-763241, mp-777037",2.0,1.0,-2.0475731855255788,-0.022494575982585602,0.5328283222046102,27841.608695652172
"mp-300025510, Li2CrPCO7, Li3CrPCO7, mp-777037, mp-25510",1.0,2.0,-1.8568707350797296,-0.00487568752808513,0.5206731161047119,26767.333333333332
"mp-300025536, LiFePCO7, Li2FePCO7, mp-25529, mp-769972",1.0,2.0,-2.5069950108423904,-0.06014881150290759,0.527466282379094,29011.454545454544
"mp-300025536, Li2FePCO7, Li3FePCO7, mp-769972, mp-25536",2.0,2.0,-1.9324793535424813,-0.009902809013049222,0.5407113153977924,26786.166666666668
"mp-300025562, MnPO4F, LiMnPO4F, mp-25550, mp-25552",2.0,2.0,-2.123676816531842,0.08673724452092799,0.48848698304876353,27104.571428571428
"mp-300025562, LiMnPO4F, Li2MnPO4F, mp-25552, mp-25562",2.0,2.0,-1.5806117717738184,0.07600575619343808,0.47401217478771085,23954.25
"mp-300025576, MoO2, Li(MoO2)2, mp-714969, mp-25576",3.0,8.0,-1.6072446112881362,0.07245600990950396,0.6949755479568487,29874.0
"mp-300025605, NiPO4F, LiNiPO4F, mp-25589, mp-504104",2.0,2.0,-2.0906811436765578,-0.06095962486882029,0.5109673885866314,27088.428571428572
"mp-300025605, LiNiPO4F, Li2NiPO4F, mp-504104, mp-25605",2.0,2.0,-1.4976298497310163,0.004821088184363664,0.46129104507039764,23930.0
"mp-300025612, LiNiPCO7, Li2NiPCO7, mp-25602, mp-25611",1.0,2.0,-2.4608511255026557,-0.10899868816530628,0.5606046821549714,29011.454545454544
"mp-300025612, Li2NiPCO7, Li3NiPCO7, mp-25611, mp-25612",1.0,4.0,-1.9630819399818278,-0.06114162418847643,0.5233506786801206,26745.583333333332
"mp-300025613, NiAsO4, LiNiAsO4, mp-635257, mp-25613",3.0,8.0,-1.7865653824169776,-0.00952369224302596,0.5238400194327381,29952.0
"mp-300025614, NiPO4, LiNi2(PO4)2, mp-540008, mp-767051",3.0,8.0,-2.143224844394057,0.02119522139441991,0.49590478582014236,30365.666666666668
"mp-300025614, LiNi2(PO4)2, LiNiPO4, mp-767051, mp-25614",1.0,2.0,-1.6590582872025577,0.05986106332728126,0.496660535743581,28192.76923076923
"mp-300025630, VPO4F, LiVPO4F, mp-25616, mp-25619",2.0,2.0,-2.316357948338246,0.10727455909377527,0.47440458134782254,27118.571428571428
"mp-300025630, LiVPO4F, Li2VPO4F, mp-25619, mp-25630",2.0,2.0,-1.5657879211697059,0.11511894664661992,0.4504593128894505,23941.125
"mp-300025637, VPO4, LiV2(PO4)2, mp-32453, mp-767232",3.0,8.0,-2.286493367851365,0.16825903267742817,0.4814624762455461,30380.5
"mp-300025637, LiV2(PO4)2, LiVPO4, mp-767232, mp-25637",1.0,2.0,-1.774901584039402,0.16300736664185608,0.4967630791500867,28170.923076923078
"mp-300025638, LiVPCO7, Li2VPCO7, mp-25629, mp-770949",1.0,2.0,-2.6571869015411216,-0.001940571098200036,0.5373374411848201,29030.636363636364
"mp-300025638, Li2VPCO7, Li3VPCO7, mp-770949, mp-25638",1.0,2.0,-1.8223001204150735,0.01239028145302771,0.5161295238928224,26753.0
"mp-300025647, WO2, LiWO2, mvc-11458, mp-25647",5.0,12.0,-1.6053781979116017,0.283975718238322,0.7630265951481653,29861.333333333332
"mp-300025652, PWO4F, LiPWO4F, mp-25651, mp-25652",2.0,2.0,-2.4756706976604805,0.288801069236246,0.6001987374662151,27089.0
"mp-300025656, LiPWCO7, Li2PWCO7, mp-540005, mp-25650",1.0,2.0,-2.68903283199213,0.11357629899246315,0.6173882678056155,29011.81818181818
"mp-300025656, Li2PWCO7, Li3PWCO7, mp-25650, mp-25656",1.0,4.0,-1.9203398688364524,0.13196636250372729,0.5889837502719701,26741.333333333332
"mp-300025660, Co2P3O10, LiCo2P3O10, mp-25658, mp-25660",1.0,4.0,0.0,-1.3240073906959124,0.9890939352897644,492.3333333333333
"mp-300025666, LiMnPCO7, Li2MnPCO7, mp-769716, mp-769717",2.0,1.0,-2.5343862585259918,-0.015009771280920937,0.5462989695399645,29021.727272727272
"mp-300025666, Li2MnPCO7, Li3MnPCO7, mp-769717, mp-25666",2.0,1.0,-2.0476380391432114,-0.013685178849093557,0.531831431824996,26761.75
"mp-300025688, FePO4F, LiFePO4F, mp-25518, mp-25515",2.0,2.0,0.0,-1.2294656571348235,0.8799571132499364,415.0
"mp-300025688, LiFePO4F, Li2FePO4F, mp-25515, mp-25688",2.0,2.0,-1.5783472129056413,0.08167931094750458,0.48733200014690536,23990.875
"mp-300025742, Cr(GeO3)2, LiCr(GeO3)2, mvc-8434, mp-25742",1.0,4.0,-1.2799583727833421,-0.08441205275221418,0.4931934270979546,30022.777777777777
"mp-300025839, LiTi2(PO4)3, Li3Ti2(PO4)3, mp-25840, mp-25839",1.0,4.0,-1.828658577244877,0.130862234274974,0.5042457807750093,30527.722222222223
"mp-300025871, LiCu2P5O16, Li3Cu2P5O16, mp-585339, mp-25871",1.0,2.0,-0.9871087105887089,0.0545641791248205,0.47817735167104786,30556.958333333332
"mp-300025881, Bi(PO3)4, LiBi(PO3)4, mp-684096, mp-25881",1.0,4.0,0.0,-1.679587399194946,1.007670246627065,465.11764705882354
"mp-300025885, CuPO4, LiCuPO4, mp-25886, mp-25885",1.0,2.0,-1.841897898589831,-0.15511361187470515,0.4563657054465719,30360.833333333332
"mp-300025907, Sn(PO3)4, LiSn(PO3)4, mp-25908, mp-25907",3.0,8.0,-2.10195544471485,0.25228897839157616,0.5164453170732864,32340.176470588234
"mp-300025929, Bi2(PO4)3, LiBi2(PO4)3, mp-26074, mp-504151",2.0,1.0,0.0,-1.507902695844292,0.9580245964659042,423.3529411764706
"mp-300025929, LiBi2(PO4)3, Li3Bi2(PO4)3, mp-504151, mp-25929",2.0,2.0,0.0,-1.3934340518077102,0.9310867787742243,408.27777777777777
"mp-300025943, LiCuP2O7, Li2CuP2O7, mp-684120, mp-25943",1.0,4.0,-1.48498762412626,0.0023298793711511345,0.4672202140422029,29207.909090909092
"mp-300025959, Bi(PO3)4, LiBi(PO3)4, mp-25960, mp-25959",1.0,4.0,0.0,-1.6795873991949455,1.0076702466270653,465.11764705882354
"mp-300026113, Ti(PO3)4, LiTi(PO3)4, mp-26114, mp-26113",3.0,8.0,-2.157926699984579,0.2365585224736005,0.5138563379720535,32356.529411764706
"mp-300026129, BiP2O7, LiBiP2O7, mp-672945, mp-26129",1.0,4.0,0.0,-1.558220564448206,0.9824404353803246,438.2
"mp-300026157, Sb(PO3)4, LiSb(PO3)4, mp-684426, mp-26157",1.0,4.0,0.0,-1.8807579593908923,1.0250751152081137,494.6470588235294
"mp-300026173, Bi3(PO5)2, LiBi3(PO5)2, mp-584116, mp-26173",2.0,1.0,0.0,-1.2596271618114934,0.9520016453474255,380.3333333333333
"mp-300026209, BiP2O7, LiBiP2O7, mp-26210, mp-26209",1.0,2.0,0.0,-1.5582205644482054,0.9824404353803246,438.2
"mp-300026223, Li3Cu(PO4)2, Li4Cu(PO4)2, mp-26224, mp-26223",1.0,2.0,-1.3525417895000529,-0.019738852529771905,0.45308848179088235,26401.14285714286
"mp-300026261, LiCu(PO3)4, Li2Cu(PO3)4, mp-26262, mp-26261",1.0,2.0,-2.2482739623161656,0.12445677612466231,0.48544790041253993,30622.333333333332
"mp-300026267, LiCu(PO3)4, Li2Cu(PO3)4, mp-672984, mp-26267",3.0,4.0,-1.9425695684005486,0.12445677612466247,0.48544790041253993,30622.333333333332
"mp-300026299, SnPO4, LiSnPO4, mp-672986, mp-26299",1.0,4.0,-2.804499760149438,0.09059302152506359,0.5524516865304836,30358.5
"mp-300026303, Cu9(PO4)8, Li6Cu9(PO4)8, mp-26304, mp-26303",2.0,2.0,-1.4547085776970994,-0.14119995839322177,0.4469051779839363,29791.0
"mp-300026311, Li3Cu(PO4)2, Li4Cu(PO4)2, mp-26794, mp-26312",1.0,2.0,-1.911038978053855,-0.01973885252977197,0.4530884817908823,26401.14285714286
"mp-300026311, Li4Cu(PO4)2, Li5Cu(PO4)2, mp-26312, mp-26311",1.0,2.0,-1.5498662045012817,0.02850317798993802,0.4419859194379549,24812.733333333334
"mp-300026341, SbP2O7, LiSbP2O7, mp-26342, mp-26341",1.0,2.0,0.0,-1.9002105167813146,1.0120287119681073,488.4
"mp-300026377, LiBi2P5O18, Li3Bi2P5O18, mp-672993, mp-26245",2.0,2.0,0.0,-1.5370477806530982,0.9479523292414437,433.2692307692308
"mp-300026377, Li3Bi2P5O18, Li5Bi2P5O18, mp-26245, mp-26377",2.0,2.0,0.0,-1.3877920179768632,0.9140374398681738,413.17857142857144
"mp-300026389, Nb2(PO4)3, LiNb2(PO4)3, mp-26390, mp-26389",1.0,4.0,-2.2067353853952008,0.1895789124792131,0.5108000651683634,32180.29411764706
"mp-300026407, SnP2O7, Li2SnP2O7, mp-757076, mp-26407",1.0,4.0,-1.9257064290042907,0.2074319335495535,0.5180930537284386,31986.8
"mp-300026409, Ti(PO3)4, LiTi(PO3)4, mp-540258, mp-26409",2.0,2.0,-1.9284009341644501,0.2365585224736003,0.5138563379720534,32356.529411764706
"mp-300026513, CuPO4, LiCuPO4, mp-673047, mp-26513",2.0,1.0,-1.9405582330308,-0.15511361187470518,0.4563657054465718,30360.833333333332
"mp-300026531, Cu2P3O10, LiCu2P3O10, mp-26532, mp-26531",1.0,4.0,0.0,-1.4936802251546084,0.8883472973979548,437.6666666666667
"mp-300026541, Sb(PO3)4, LiSb(PO3)4, mp-26542, mp-26541",3.0,4.0,0.0,-1.8807579593908925,1.0250751152081135,494.6470588235294
"mp-300026549, Nb(PO3)4, LiNb(PO3)4, mp-26550, mp-26549",3.0,8.0,-2.2712954818026656,0.2686670304259838,0.5091773985171317,32323.58823529412
"mp-300026585, LiSb2P5O18, Li3Sb2P5O18, mp-673090, mp-26586",2.0,2.0,-2.0080636352876193,0.2571269201053068,0.556917930657891,31680.884615384617
"mp-300026585, Li3Sb2P5O18, Li5Sb2P5O18, mp-26586, mp-26585",2.0,1.0,-1.6294236612002704,0.22304243470487747,0.5538867656517851,29429.035714285714
"mp-300026629, TiP2O7, LiTiP2O7, mp-26630, mp-26629",1.0,2.0,-2.9084440810624117,0.1806901584889947,0.5136917892563424,32014.6
"mp-300026649, SnP2O7, Li2SnP2O7, mp-757192, mp-26649",2.0,2.0,-2.8730190202788113,0.20743193354955353,0.5180930537284384,31986.8
"mp-300026675, Sb(PO3)4, LiSb(PO3)4, mp-673069, mp-26675",1.0,4.0,-1.8604665235523088,0.22467506295325274,0.5590322750989062,32175.70588235294
"mp-300026695, CuPO4, LiCuPO4, mp-753519, mp-25449",3.0,8.0,-2.4969032990092157,-0.1551136118747051,0.4563657054465719,30360.833333333332
"mp-300026695, LiCuPO4, Li2CuPO4, mp-25449, mp-26695",3.0,8.0,-1.4006662959514775,-0.03239858085462187,0.432106325596629,26391.428571428572
"mp-300026701, LiSn2(PO4)3, Li3Sn2(PO4)3, mp-27094, mp-26701",1.0,4.0,-1.7949929232931205,0.16057531767559466,0.5091360746328939,30496.833333333332
"mp-300026721, LiNb(PO4)2, Li2Nb(PO4)2, mp-673070, mp-26721",1.0,2.0,-2.525207226563294,0.1522004696997544,0.5022877756514353,30550.083333333332
"mp-300026725, SnPO4, LiSnPO4, mp-673078, mp-26725",1.0,2.0,-1.845065127056412,0.044140384947564684,0.5487011464016214,30221.88888888889
"mp-300026741, Cu4(PO4)3, LiCu4(PO4)3, mp-26742, mp-26741",1.0,4.0,-1.5485274640291173,-0.1192310318435113,0.4319675030429327,28891.263157894737
"mp-300026767, Nb(PO3)4, LiNb(PO3)4, mp-673088, mp-26767",2.0,2.0,-2.078249489292494,0.2686670304259838,0.5091773985171317,32323.58823529412
"mp-300026795, Cu5P3O13, LiCu5P3O13, mp-26796, mp-26795",2.0,2.0,-1.6430744449693195,-0.1438334163518135,0.447167661733637,26222.47619047619
"mp-300026823, Cu3(P2O7)2, Li2Cu3(P2O7)2, mp-673105, mp-26823",1.0,4.0,-1.7624060081173765,-0.03951764074516434,0.46183545122437847,30469.666666666668
"mp-300026835, Bi5(PO4)6, Li3Bi5(PO4)6, mp-673116, mp-26835",2.0,1.0,0.0,-1.430251963318186,0.9693952396519395,413.4
"mp-300026851, LiCuPO4, Li2CuPO4, mp-673128, mp-26851",2.0,1.0,-1.8894924846501653,-0.03239858085462193,0.432106325596629,26391.428571428572
"mp-300026855, LiSn(PO3)4, Li2Sn(PO3)4, mp-26856, mp-26855",1.0,2.0,-1.8664006890158036,0.20635898725791874,0.5174765607738439,30621.555555555555
"mp-300026875, CuPO4, LiCuPO4, mp-673017, mp-26467",1.0,4.0,-2.718264201762153,-0.1551136118747051,0.4563657054465719,30360.833333333332
"mp-300026875, LiCuPO4, Li2CuPO4, mp-26467, mp-26875",1.0,4.0,-1.9220467555124898,-0.03239858085462187,0.432106325596629,26391.428571428572
"mp-300026897, Sn(PO3)3, LiSn(PO3)3, mp-673129, mp-26897",2.0,1.0,-2.3226851096455383,0.21216549433166476,0.5317961517034142,31697.384615384617
"mp-300026949, Sn2(PO3)5, LiSn2(PO3)5, mp-26950, mp-26949",1.0,2.0,-1.7613664547981136,0.20431218595615092,0.5249251655214421,31227.090909090908
"mp-300027017, SnPO4, LiSnPO4, mp-27018, mp-27017",3.0,4.0,-1.2303261825379836,0.02091406665881494,0.5468258763371905,30153.583333333332
